{
  "$schema": "https://json-schema.org/draft/2020-12/schema",
  "$id": "https://pi-desktop.dev/schema/feature-v1.json",
  "title": "Pi Desktop Feature Manifest v1",
  "type": "object",
  "required": ["apiVersion", "id", "name", "ui"],
  "properties": {
    "apiVersion": { "const": 1 },
    "id": {
      "type": "string",
      "minLength": 1,
      "maxLength": 64,
      "pattern": "^[A-Za-z0-9._-]+$"
    },
    "name": { "type": "string", "minLength": 1 },
    "version": { "type": "string", "minLength": 1 },
    "publisher": { "type": "string", "minLength": 1 },
    "description": { "type": "string" },
    "icon": { "type": "string" },
    "order": { "type": "integer", "default": 100 },
    "ui": {
      "type": "object",
      "required": ["entry"],
      "properties": {
        "entry": { "type": "string", "minLength": 1 }
      },
      "additionalProperties": true
    },
    "service": {
      "type": "object",
      "required": ["command"],
      "properties": {
        "command": { "type": "string", "minLength": 1 },
        "args": { "type": "array", "items": { "type": "string" }, "default": [] },
        "env": {
          "type": "object",
          "additionalProperties": { "type": "string" },
          "default": {}
        }
      },
      "additionalProperties": true
    }
  },
  "additionalProperties": true
}
